{
  "schema_version": "1.0.0",
  "protocol_version": "1.2",
  "prior_assumption": "A trigger recommendation executes a cycle.",
  "new_evidence": ["The trigger returns a prompt for a caller."],
  "revised_rule": "Describe the trigger as a recommendation until host execution is verified.",
  "confidence": 0.99,
  "revisit_condition": "A host integration test demonstrates autonomous execution."
}
